{
  "distinctive_features": [],
  "frames": [
    {
      "analysis_method": "deterministic_rgb_layout_heuristics",
      "confidence": "MEDIUM",
      "frame_id": "117539389-001",
      "height": 1080,
      "listing_id": "117539389",
      "media_type": "PHOTO",
      "scene_labels": "OTHER|GARDEN",
      "sha256": "729d55bbe9d1ec6a9c7e7011209d358696efe4320f77676ee43964c6878b82b6",
      "source_url": "https://images.prop24.com/382490579",
      "structure_labels": "UNKNOWN_STRUCTURE",
      "width": 1080
    },
    {
      "analysis_method": "deterministic_rgb_layout_heuristics",
      "confidence": "MEDIUM",
      "frame_id": "117539389-002",
      "height": 1080,
      "listing_id": "117539389",
      "media_type": "PHOTO",
      "scene_labels": "OTHER|GARDEN",
      "sha256": "aab456cc45052824738d4e44200f021a2ff8906d99c58f43f3a054cb11032bb2",
      "source_url": "https://images.prop24.com/376362272",
      "structure_labels": "UNKNOWN_STRUCTURE",
      "width": 1080
    },
    {
      "analysis_method": "deterministic_rgb_layout_heuristics",
      "confidence": "MEDIUM",
      "frame_id": "117539389-003",
      "height": 1080,
      "listing_id": "117539389",
      "media_type": "PHOTO",
      "scene_labels": "OTHER|GARDEN|POOL|POOL_AND_HOUSE",
      "sha256": "a8b3a94d4ea8318228172fd0badabb6d55c989fdbde8983cbc143681b4439be5",
      "source_url": "https://images.prop24.com/382233512",
      "structure_labels": "UNKNOWN_STRUCTURE",
      "width": 1080
    },
    {
      "analysis_method": "deterministic_rgb_layout_heuristics",
      "confidence": "MEDIUM",
      "frame_id": "117539389-004",
      "height": 1080,
      "listing_id": "117539389",
      "media_type": "PHOTO",
      "scene_labels": "OTHER|POOL",
      "sha256": "f340fc8f6a43984817fa37833802871a5af2f55f7ef27a018c8e5f22a8c35dd4",
      "source_url": "https://images.prop24.com/385013636",
      "structure_labels": "UNKNOWN_STRUCTURE",
      "width": 1623
    },
    {
      "analysis_method": "deterministic_rgb_layout_heuristics",
      "confidence": "MEDIUM",
      "frame_id": "117539389-005",
      "height": 500,
      "listing_id": "117539389",
      "media_type": "PHOTO",
      "scene_labels": "OTHER|AERIAL_VIEW",
      "sha256": "060887d3d36106daaddc300110d5351eea58ffc212096c1c59ac32e95e402e24",
      "source_url": "https://images.prop24.com/367695098",
      "structure_labels": "UNKNOWN_STRUCTURE",
      "width": 1000
    },
    {
      "analysis_method": "deterministic_rgb_layout_heuristics",
      "confidence": "LOW",
      "frame_id": "117539389-006",
      "height": 1080,
      "listing_id": "117539389",
      "media_type": "PHOTO",
      "scene_labels": "OTHER",
      "sha256": "f556a395bc7f3629abfb98ebe55dd08d8b51cea5069ffc5daf3e1d003eb0ca35",
      "source_url": "https://images.prop24.com/385013603",
      "structure_labels": "UNKNOWN_STRUCTURE",
      "width": 1623
    },
    {
      "analysis_method": "deterministic_rgb_layout_heuristics",
      "confidence": "LOW",
      "frame_id": "117539389-007",
      "height": 1080,
      "listing_id": "117539389",
      "media_type": "PHOTO",
      "scene_labels": "OTHER",
      "sha256": "9919084e6f7a89d85ad81f309d06d70b87bea0c91d54746900cf5cea690466d5",
      "source_url": "https://images.prop24.com/385013604",
      "structure_labels": "UNKNOWN_STRUCTURE",
      "width": 1623
    },
    {
      "analysis_method": "deterministic_rgb_layout_heuristics",
      "confidence": "MEDIUM",
      "frame_id": "117539389-008",
      "height": 1080,
      "listing_id": "117539389",
      "media_type": "PHOTO",
      "scene_labels": "OTHER|INTERIOR",
      "sha256": "f90f2430d2e98514ecdb3974a84bf51908af812c57a69d127f204597331d2a31",
      "source_url": "https://images.prop24.com/385013605",
      "structure_labels": "UNKNOWN_STRUCTURE",
      "width": 1623
    },
    {
      "analysis_method": "deterministic_rgb_layout_heuristics",
      "confidence": "LOW",
      "frame_id": "117539389-009",
      "height": 1080,
      "listing_id": "117539389",
      "media_type": "PHOTO",
      "scene_labels": "OTHER",
      "sha256": "5821b97f28162cc444515cca2f15dfd0263baa92710d001e43cde62b5390c220",
      "source_url": "https://images.prop24.com/385013606",
      "structure_labels": "UNKNOWN_STRUCTURE",
      "width": 1623
    },
    {
      "analysis_method": "deterministic_rgb_layout_heuristics",
      "confidence": "LOW",
      "frame_id": "117539389-010",
      "height": 1080,
      "listing_id": "117539389",
      "media_type": "PHOTO",
      "scene_labels": "OTHER",
      "sha256": "0ef7d2cf34e647e461ca7eeef6bc6c57a57f9a0d710f1548075ced5ed011cfa1",
      "source_url": "https://images.prop24.com/385013607",
      "structure_labels": "UNKNOWN_STRUCTURE",
      "width": 1623
    },
    {
      "analysis_method": "deterministic_rgb_layout_heuristics",
      "confidence": "MEDIUM",
      "frame_id": "117539389-011",
      "height": 1080,
      "listing_id": "117539389",
      "media_type": "PHOTO",
      "scene_labels": "OTHER|POOL",
      "sha256": "70d55a4cd66a282fa08cc764c3e9d7a0ec60818ca04bc4ad4be48a9540374c18",
      "source_url": "https://images.prop24.com/385013608",
      "structure_labels": "UNKNOWN_STRUCTURE",
      "width": 1623
    },
    {
      "analysis_method": "deterministic_rgb_layout_heuristics",
      "confidence": "MEDIUM",
      "frame_id": "117539389-012",
      "height": 1080,
      "listing_id": "117539389",
      "media_type": "PHOTO",
      "scene_labels": "OTHER|POOL",
      "sha256": "bf6d3f2247e46f015b07c3f0e262ba0ebb76035a479c53d688442f0f0d18e17d",
      "source_url": "https://images.prop24.com/385013609",
      "structure_labels": "UNKNOWN_STRUCTURE",
      "width": 1623
    },
    {
      "analysis_method": "deterministic_rgb_layout_heuristics",
      "confidence": "MEDIUM",
      "frame_id": "117539389-013",
      "height": 1080,
      "listing_id": "117539389",
      "media_type": "PHOTO",
      "scene_labels": "OTHER|POOL",
      "sha256": "30bee8677e3a6bef7cc0a8d49fda9485d2aba833062c20de604def6f4f51a0a4",
      "source_url": "https://images.prop24.com/385013610",
      "structure_labels": "UNKNOWN_STRUCTURE",
      "width": 1623
    },
    {
      "analysis_method": "deterministic_rgb_layout_heuristics",
      "confidence": "MEDIUM",
      "frame_id": "117539389-014",
      "height": 1080,
      "listing_id": "117539389",
      "media_type": "PHOTO",
      "scene_labels": "OTHER|INTERIOR",
      "sha256": "ba7de33ec51c7860d4f6eafb4842cd2af1f4445eb5cad97f5310a5a45fefc98e",
      "source_url": "https://images.prop24.com/385013611",
      "structure_labels": "UNKNOWN_STRUCTURE",
      "width": 1623
    },
    {
      "analysis_method": "deterministic_rgb_layout_heuristics",
      "confidence": "LOW",
      "frame_id": "117539389-015",
      "height": 1080,
      "listing_id": "117539389",
      "media_type": "PHOTO",
      "scene_labels": "OTHER",
      "sha256": "0b5ccefdd4f0d2e4ebe3b12b9dce042fd4704f393b66d692bb095ad4f8c89b54",
      "source_url": "https://images.prop24.com/385013612",
      "structure_labels": "UNKNOWN_STRUCTURE",
      "width": 1623
    },
    {
      "analysis_method": "deterministic_rgb_layout_heuristics",
      "confidence": "LOW",
      "frame_id": "117539389-016",
      "height": 1080,
      "listing_id": "117539389",
      "media_type": "PHOTO",
      "scene_labels": "OTHER",
      "sha256": "01448820e25d513a9da71c9be7464c7a65951590b909a03ddd83f1c56d61476d",
      "source_url": "https://images.prop24.com/385013613",
      "structure_labels": "UNKNOWN_STRUCTURE",
      "width": 1623
    },
    {
      "analysis_method": "deterministic_rgb_layout_heuristics",
      "confidence": "LOW",
      "frame_id": "117539389-017",
      "height": 1080,
      "listing_id": "117539389",
      "media_type": "PHOTO",
      "scene_labels": "OTHER",
      "sha256": "69ba01e8ffede6839909d8aa6892e088efb8ae21c0e590b24ce52a603c98473f",
      "source_url": "https://images.prop24.com/385013614",
      "structure_labels": "UNKNOWN_STRUCTURE",
      "width": 1623
    },
    {
      "analysis_method": "deterministic_rgb_layout_heuristics",
      "confidence": "LOW",
      "frame_id": "117539389-018",
      "height": 1080,
      "listing_id": "117539389",
      "media_type": "PHOTO",
      "scene_labels": "OTHER",
      "sha256": "17fd47f47fa6f9bf32f78bd6f1e58c761ad08fd356be6063d5a09b806ba174c9",
      "source_url": "https://images.prop24.com/385013615",
      "structure_labels": "UNKNOWN_STRUCTURE",
      "width": 1623
    },
    {
      "analysis_method": "deterministic_rgb_layout_heuristics",
      "confidence": "LOW",
      "frame_id": "117539389-019",
      "height": 1080,
      "listing_id": "117539389",
      "media_type": "PHOTO",
      "scene_labels": "OTHER",
      "sha256": "2f3081dde6e8ef22f5c8e5cdb27b236afe2cfecbf533924587db5e426e30f465",
      "source_url": "https://images.prop24.com/385013616",
      "structure_labels": "UNKNOWN_STRUCTURE",
      "width": 1623
    },
    {
      "analysis_method": "deterministic_rgb_layout_heuristics",
      "confidence": "LOW",
      "frame_id": "117539389-020",
      "height": 1080,
      "listing_id": "117539389",
      "media_type": "PHOTO",
      "scene_labels": "OTHER",
      "sha256": "f2f783bc0868eaeed3f778285a5665bf7787065489991702b0ba94788b49754e",
      "source_url": "https://images.prop24.com/385013617",
      "structure_labels": "UNKNOWN_STRUCTURE",
      "width": 1623
    },
    {
      "analysis_method": "deterministic_rgb_layout_heuristics",
      "confidence": "LOW",
      "frame_id": "117539389-021",
      "height": 1080,
      "listing_id": "117539389",
      "media_type": "PHOTO",
      "scene_labels": "OTHER",
      "sha256": "7b0ee676ac557c8e2c2108730cd3fc38306dcdbfab7946ae58dd150fec6da283",
      "source_url": "https://images.prop24.com/385013618",
      "structure_labels": "UNKNOWN_STRUCTURE",
      "width": 1623
    },
    {
      "analysis_method": "deterministic_rgb_layout_heuristics",